{
  "metadata": {
    "schema_version": "v1",
    "created_at": "2026-04-21T12:00:00Z",
    "updated_at": "2026-04-21T12:00:00Z",
    "source_mode": "auto",
    "owner": "Med Auto Grant funding discovery"
  },
  "discovery_input_id": "funding-discovery-cardio-001",
  "mode": "auto",
  "rough_direction_hint": "心梗后免疫-成纤维细胞互作与转化干预",
  "applicant_profile": {
    "metadata": {
      "schema_version": "v1",
      "created_at": "2026-04-06T10:00:00Z",
      "updated_at": "2026-04-07T12:00:00Z",
      "source_mode": "auto"
    },
    "applicant_id": "applicant-gaofeng",
    "applicant_name": "示例申请人",
    "institution": "示例医学院",
    "career_stage": "faculty",
    "research_domains": [
      "心血管医学",
      "炎症与纤维化"
    ],
    "clinical_domains": [
      "心力衰竭"
    ],
    "methods_stack": [
      "单细胞测序",
      "空间转录组",
      "动物模型"
    ],
    "training_background": [
      "临床医学",
      "转化医学"
    ],
    "strengths": [
      "有心血管队列资源",
      "有跨组学分析经验"
    ],
    "constraints": [
      "时序预实验仍需补足"
    ]
  },
  "track_record": {
    "metadata": {
      "schema_version": "v1",
      "created_at": "2026-04-06T10:00:00Z",
      "updated_at": "2026-04-07T12:00:00Z",
      "source_mode": "auto"
    },
    "track_record_id": "track-001",
    "representative_outputs": [
      {
        "output_id": "output-1",
        "title": "单细胞图谱揭示心肌梗死后免疫重塑",
        "output_type": "paper",
        "year": 2024,
        "relevance_summary": "提供免疫细胞时序变化和成纤维细胞通讯线索。",
        "evidence": {
          "evidence_id": "evi-output-1",
          "label": "代表作 1",
          "source_type": "publication",
          "uri": "https://example.org/paper-1"
        }
      }
    ],
    "prior_grants": [
      "省部级青年项目"
    ],
    "awards": [
      "青年拔尖人才"
    ]
  },
  "include_funders": [
    "NSFC",
    "NIH"
  ]
}
